{
  "$schema": "https://json-schema.org/draft/2020-12/schema",
  "$id": "https://example.com/schemas/homepage-request.schema.json",
  "title": "HomepageRequest",
  "type": "object",
  "additionalProperties": false,
  "required": [
    "request_id",
    "company_id",
    "homepage_type",
    "company_name",
    "industry",
    "business_type",
    "main_business_description"
  ],
  "properties": {
    "request_id": { "type": "string", "minLength": 1 },
    "company_id": {
      "type": "string",
      "minLength": 1,
      "pattern": "^[A-Za-z0-9_-]+$"
    },
    "homepage_type": { "type": "string", "enum": ["company_intro", "product"] },
    "company_name": { "type": "string", "minLength": 1 },
    "industry": { "type": "string", "minLength": 1 },
    "business_type": { "type": "string", "minLength": 1 },
    "main_business_description": { "type": "string", "minLength": 10 },
    "one_line_intro": { "type": "string" },
    "company_intro": { "type": "string" },
    "cover_image_url": { "type": "string" },
    "tags": {
      "type": "array",
      "items": { "type": "string", "minLength": 1 },
      "maxItems": 12
    },
    "contact": {
      "type": "object",
      "additionalProperties": false,
      "properties": {
        "address": { "type": "string" },
        "phone": { "type": "string" },
        "email": { "type": "string" },
        "website_url": { "type": "string" }
      }
    },
    "core_strengths": {
      "type": "array",
      "items": { "type": "string", "minLength": 1 },
      "maxItems": 10
    },
    "products": {
      "type": "array",
      "items": {
        "type": "object",
        "additionalProperties": false,
        "required": ["name"],
        "properties": {
          "name": { "type": "string", "minLength": 1 },
          "description": { "type": "string" },
          "image_url": { "type": "string" }
        }
      }
    },
    "portfolio": {
      "type": "array",
      "items": {
        "type": "object",
        "additionalProperties": true,
        "properties": {
          "title": { "type": "string" },
          "description": { "type": "string" }
        }
      }
    },
    "history": {
      "type": "array",
      "items": {
        "type": "object",
        "additionalProperties": false,
        "required": ["year", "text"],
        "properties": {
          "year": { "type": "string" },
          "text": { "type": "string" }
        }
      }
    },
    "section_visibility": {
      "type": "object",
      "additionalProperties": false,
      "properties": {
        "company_summary": { "type": "boolean" },
        "contact_info": { "type": "boolean" },
        "company_intro": { "type": "boolean" },
        "core_strengths": { "type": "boolean" },
        "history": { "type": "boolean" },
        "portfolio": { "type": "boolean" },
        "featured_products": { "type": "boolean" },
        "product_area": { "type": "boolean" },
        "product_registration_cta": { "type": "boolean" },
        "contact_cta": { "type": "boolean" }
      }
    },
    "section_layout": {
      "type": "object",
      "additionalProperties": false,
      "properties": {
        "core_strengths": { "type": "string", "enum": ["list", "grid_2"] },
        "history": { "type": "string", "enum": ["timeline", "compact"] },
        "portfolio": { "type": "string", "enum": ["list", "grid_2"] },
        "featured_products": { "type": "string", "enum": ["grid_2", "grid_3"] },
        "product_area": { "type": "string", "enum": ["grid_2", "grid_3"] }
      }
    },
    "content_density": { "type": "string", "enum": ["compact", "standard", "rich"] },
    "design_tokens": {
      "type": "object",
      "additionalProperties": false,
      "properties": {
        "primary": { "type": "string", "enum": ["#2f6fed", "#12a37f", "#4f7fe8", "#264f9d", "#0f766e", "#334155"] },
        "accent": { "type": "string", "enum": ["#2f6fed", "#12a37f", "#4f7fe8", "#264f9d", "#0f766e", "#334155"] },
        "radius": { "type": "string", "enum": ["none", "sm", "md", "lg"] }
      }
    },
    "section_order": {
      "type": "array",
      "uniqueItems": true,
      "items": {
        "type": "string",
        "enum": ["hero", "company_summary", "company_intro", "core_strengths", "contact_info", "history", "portfolio", "featured_products", "product_area", "product_registration_cta", "contact_cta"]
      }
    },
    "block_overrides": {
      "type": "object",
      "propertyNames": {
        "enum": ["hero", "company_summary", "company_intro", "core_strengths", "contact_info", "history", "portfolio", "featured_products", "product_area", "product_registration_cta", "contact_cta"]
      },
      "additionalProperties": {
        "type": "object",
        "additionalProperties": false,
        "properties": {
          "emphasis": { "type": "string", "enum": ["default", "strong"] }
        }
      }
    },
    "content_source": {
      "type": "string",
      "enum": ["request_only", "ai_suggested", "ai_suggested_user_confirmed"]
    },
    "homepage_plan": {
      "$ref": "homepage-plan.schema.json"
    },
    "content_draft": {
      "$ref": "content-draft.schema.json"
    },
    "draft_id": { "type": "string" },
    "confirmed_at": { "type": "string" },
    "preferred_style": { "type": "string", "enum": ["clean", "modern", "basic", "professional"] },
    "created_at": { "type": "string" }
  }
}
