{
  "request_id": "REQ_COMPANY_001",
  "company_id": "COMPANY_001",
  "homepage_type": "company_intro",
  "company_name": "주식회사 샘플AI",
  "industry": "IT·소프트웨어",
  "business_type": "소프트웨어 개발 및 공급",
  "main_business_description": "AI 기반 재고관리 솔루션을 개발하고 중소기업에 공급합니다.",
  "one_line_intro": "중소기업을 위한 AI 재고관리 솔루션",
  "company_intro": "AI 기반 재고관리 솔루션을 통해 입출고와 발주 업무를 효율화합니다.",
  "core_strengths": [
    "AI 기반 재고 예측",
    "입출고 통합 관리",
    "중소기업 맞춤형 사용성"
  ],
  "products": [],
  "portfolio": [],
  "history": [],
  "preferred_style": "clean",
  "created_at": "2026-05-16T10:00:00+09:00"
}
