{
  "request_id": "REQ_PRODUCT_ITEMS_001",
  "company_id": "COMPANY_003",
  "homepage_type": "product",
  "company_name": "바른공구",
  "industry": "도소매업",
  "business_type": "산업용 공구 유통",
  "main_business_description": "산업 현장에서 사용하는 전동공구와 작업 소모품을 유통합니다.",
  "one_line_intro": "현장에 필요한 산업용 공구를 공급합니다",
  "company_intro": "전동공구와 작업 소모품을 유통하며 산업 현장의 원활한 작업 환경을 지원합니다.",
  "core_strengths": [
    "산업 현장 중심 제품 구성",
    "전동공구와 소모품 통합 공급",
    "작업 환경에 맞춘 제품 안내"
  ],
  "products": [
    {
      "name": "전동 드릴 세트",
      "description": "작업 현장에서 사용할 수 있는 전동 드릴 구성입니다."
    },
    {
      "name": "작업 장갑",
      "description": "현장 작업을 위한 기본 보호 장갑입니다."
    }
  ],
  "portfolio": [],
  "history": [],
  "preferred_style": "basic",
  "created_at": "2026-05-16T10:00:00+09:00"
}
