{
  "request_id": "REQ_RESULT_STYLE_FULL",
  "company_id": "COMPANY_RESULT_STYLE_FULL",
  "homepage_type": "company_intro",
  "company_name": "주식회사 결과스타일",
  "industry": "제조업",
  "business_type": "스마트팩토리 설비 모니터링 솔루션 개발 및 공급",
  "main_business_description": "공장 설비 데이터를 실시간으로 수집하고 이상 징후를 빠르게 감지하는 스마트팩토리 모니터링 솔루션을 개발하고 공급합니다.",
  "one_line_intro": "공장 설비 상태를 실시간으로 확인하는 스마트팩토리 모니터링 솔루션",
  "company_intro": "주식회사 결과스타일은 제조 현장의 설비 데이터를 수집하고 운영자가 빠르게 의사결정할 수 있도록 모니터링 화면과 알림 기능을 제공하는 회사입니다.",
  "cover_image_url": "https://example.com/assets/factory-monitoring-cover.jpg",
  "tags": [
    "스마트팩토리",
    "설비 모니터링",
    "제조 데이터"
  ],
  "contact": {
    "address": "서울특별시 중구 테스트로 12",
    "phone": "02-1234-5678",
    "email": "hello@example.com",
    "website_url": "https://example.com"
  },
  "core_strengths": [
    "실시간 설비 모니터링",
    "이상 징후 알림",
    "제조 현장 맞춤 구축"
  ],
  "products": [
    {
      "name": "설비 모니터링 대시보드",
      "description": "공장 설비 상태와 알림을 한 화면에서 확인하는 대시보드입니다.",
      "image_url": "https://example.com/assets/dashboard.jpg"
    }
  ],
  "portfolio": [
    {
      "title": "생산라인 모니터링 화면 구축",
      "description": "생산라인 설비 상태를 실시간으로 확인하는 화면을 구축했습니다."
    }
  ],
  "history": [
    {
      "year": "2025",
      "text": "스마트팩토리 모니터링 솔루션 공급을 시작했습니다."
    }
  ],
  "preferred_style": "professional",
  "created_at": "2026-05-17T10:00:00+09:00"
}
