{
  "request_id": "REQ_FAKE_CLAIM_001",
  "company_id": "COMPANY_FAKE_CLAIM",
  "homepage_type": "company_intro",
  "company_name": "주식회사 검증대상",
  "industry": "IT·소프트웨어",
  "business_type": "소프트웨어 개발 및 공급",
  "main_business_description": "업무 관리 소프트웨어를 개발하고 기업 고객에게 공급합니다.",
  "one_line_intro": "기업 업무 관리를 위한 소프트웨어",
  "company_intro": "업무 관리 소프트웨어를 통해 기업의 반복 업무를 정리합니다.",
  "core_strengths": [
    "업무 흐름 정리",
    "운영 데이터 관리"
  ],
  "products": [],
  "portfolio": [],
  "history": [],
  "preferred_style": "clean",
  "created_at": "2026-05-16T10:00:00+09:00"
}
