{
  "request_id": "REQ_COMPANY_HISTORY_001",
  "company_id": "COMPANY_HISTORY_001",
  "homepage_type": "company_intro",
  "company_name": "주식회사 기록샘플",
  "industry": "IT·소프트웨어",
  "business_type": "소프트웨어 개발 및 공급",
  "main_business_description": "업무 관리 소프트웨어를 개발하고 기업 고객에게 공급합니다.",
  "one_line_intro": "기업 업무 관리를 위한 소프트웨어",
  "company_intro": "업무 관리 소프트웨어를 통해 기업의 반복 업무를 정리합니다.",
  "core_strengths": [
    "업무 흐름 정리",
    "운영 데이터 관리"
  ],
  "products": [],
  "portfolio": [
    {
      "title": "업무 관리 시스템 구축",
      "description": "기업 내부 업무 흐름을 정리하는 시스템을 구축했습니다."
    }
  ],
  "history": [
    {
      "year": "2025",
      "text": "업무 관리 소프트웨어 공급을 시작했습니다."
    }
  ],
  "preferred_style": "clean",
  "created_at": "2026-05-16T10:00:00+09:00"
}
