{
  "request_id": "REQ_RESULT_STYLE_EMPTY",
  "company_id": "COMPANY_RESULT_STYLE_EMPTY",
  "homepage_type": "company_intro",
  "company_name": "주식회사 빈옵션",
  "industry": "IT·소프트웨어",
  "business_type": "업무 자동화 솔루션 개발 및 공급",
  "main_business_description": "기업의 반복 업무를 줄이는 업무 자동화 솔루션을 개발하고 공급합니다.",
  "one_line_intro": "반복 업무를 줄이는 자동화 솔루션",
  "company_intro": "주식회사 빈옵션은 기업의 업무 흐름을 분석하고 자동화 시스템을 구축하는 회사입니다.",
  "core_strengths": [
    "업무 자동화",
    "데이터 관리"
  ],
  "products": [],
  "portfolio": [],
  "history": [],
  "preferred_style": "clean",
  "created_at": "2026-05-17T10:00:00+09:00"
}
