{
  "request_id": "REQ_PRODUCT_EMPTY_001",
  "company_id": "COMPANY_002",
  "homepage_type": "product",
  "company_name": "동행패키징",
  "industry": "제조업",
  "business_type": "포장재 제조 및 도소매",
  "main_business_description": "식품 포장에 사용하는 친환경 종이 포장재를 제조하고 소상공인에게 공급합니다.",
  "one_line_intro": "소상공인을 위한 친환경 포장재 파트너",
  "company_intro": "친환경 종이 포장재를 제조하고 공급하여 소상공인의 포장 업무를 지원합니다.",
  "core_strengths": [
    "친환경 종이 소재 활용",
    "소상공인 맞춤 공급",
    "식품 포장에 적합한 제품 구성"
  ],
  "products": [],
  "portfolio": [],
  "history": [],
  "preferred_style": "professional",
  "created_at": "2026-05-16T10:00:00+09:00"
}
